<?xml version="1.0" encoding="UTF-8"?>  
<arf:GUHAFeatureList xmlns:xsi="http://www.w3.org/2001/XMLSchema-instance"
    xsi:schemaLocation="http://keg.vse.cz/ns/arfeatures_01 http://sewebar.vse.cz/schemas/GUHAARfeature.xsd"
    xmlns:arf="http://keg.vse.cz/ns/arfeatures_01" mode="AssociationRules" procedure="4ft">
    <UserInterface>
        <AllowMultipleRules>false</AllowMultipleRules>
    </UserInterface>
    
    <RulePattern>
        <Antecedent minNumberOfBBAs="1"/>
        <Consequent minNumberOfBBAs="1"/>
        <Condition minNumberOfBBAs="0" maxNumberOfBBAs="0"/>
        
        <GeneralConstraint minNumberOfBBAs="2"/>
    </RulePattern>
    
    <BuildingBlocks>
        <InterestMeasures threshold="required">
            <Types>
                <Type>
                    <Name>BASE</Name>
                    <LocalizedName lang="en">Support</LocalizedName>
                    <LocalizedName lang="cs">Podpora</LocalizedName>
                    <ThresholdType>% of all</ThresholdType>
                    <CompareType>Greater than or equal</CompareType>
                    <Field>
                        <Name>prahovaHodnota</Name>
                        <LocalizedName lang="en">threshold value</LocalizedName>
                        <LocalizedName lang="cs">prahová hodnota</LocalizedName>
                        <Validation>
                            <MinValue inclusive="no">0</MinValue>
                            <MaxValue inclusive="no">1</MaxValue>
                            <Datatype>double</Datatype>
                        </Validation>
                    </Field>
                </Type>
                <Type>
                    <Name>FUI</Name>
                    <LocalizedName lang="en">Confidence</LocalizedName>
                    <LocalizedName lang="cs">Spolehlivost</LocalizedName>
                    <ThresholdType>Abs</ThresholdType>
                    <CompareType>Greater than or equal</CompareType>
                    <Field>
                        <Name>prahovaHodnota</Name>
                        <LocalizedName lang="en">threshold value</LocalizedName>
                        <LocalizedName lang="cs">prahová hodnota</LocalizedName>
                        <Validation>
                            <MinValue inclusive="no">0</MinValue>
                            <MaxValue inclusive="no">1</MaxValue>
                            <Datatype>double</Datatype>
                        </Validation>
                    </Field>
                </Type>
                <Type>
                    <Name>AAD</Name>
                    <LocalizedName lang="en">Lift</LocalizedName>
                    <LocalizedName lang="cs">Lift</LocalizedName>
                    <ThresholdType>Abs</ThresholdType>                                        
                    <CompareType>Greater than or equal</CompareType>
                    
                    <Field>
                        <Name>prahovaHodnota</Name>
                        <LocalizedName lang="en">threshold value</LocalizedName>
                        <LocalizedName lang="cs">prahová hodnota</LocalizedName>
                        <Validation>
                            <MinValue inclusive="no">0</MinValue>
                            <MaxValue inclusive="no">INF</MaxValue>
                            <Datatype>double</Datatype>
                        </Validation>
                    </Field>
                </Type>
                
            </Types>
            <SupportedInterestMeasureCombinations>
                <SupportedIMCombination>
                    <InterestMeasure>BASE</InterestMeasure>
                    
                    <InterestMeasure>FUI</InterestMeasure>
                </SupportedIMCombination>
                <SupportedIMCombination>
                    <InterestMeasure>AAD</InterestMeasure>
                    <InterestMeasure>BASE</InterestMeasure>
                </SupportedIMCombination>
                <SupportedIMCombination>
                    
                    <InterestMeasure>BASE</InterestMeasure>
                </SupportedIMCombination>
                <SupportedIMCombination>
                    <InterestMeasure>FUI</InterestMeasure>
                </SupportedIMCombination>
                <SupportedIMCombination>
                    <InterestMeasure>AAD</InterestMeasure>
                    
                </SupportedIMCombination>
            </SupportedInterestMeasureCombinations>
            
        </InterestMeasures>
        
        <BasicBooleanAttribute coefficient="required">
            <Coefficient>
                <Type>
                    <Name>One category</Name>
                    
                    <Field>
                        <Name>category</Name>
                        <LocalizedName lang="en">category</LocalizedName>
                        <LocalizedName lang="cs">kategorie</LocalizedName>
                        <Validation>
                            <Required value="yes"/>
                            <Datatype>string</Datatype>
                            
                        </Validation>
                    </Field>
                </Type>
                <Type>
                    <Name>Subset</Name>
                    <Field>
                        <Name>minLength</Name>
                        <LocalizedName lang="en">minimum length</LocalizedName>
                        
                        <LocalizedName lang="cs">minimální délka</LocalizedName>
                        <Validation>
                            <Required value="yes"/>
                            <MinValue>1</MinValue>
                            <MaxValue>1</MaxValue>
                            <Datatype>integer</Datatype>
                        </Validation>
                        
                    </Field>
                    
                    <Field>
                        <Name>maxLength</Name>
                        <LocalizedName lang="en">maximum length</LocalizedName>
                        <LocalizedName lang="cs">maximální délka</LocalizedName>
                        <Validation>
                            <Required value="yes"/>
                            
                            <MinValue>1</MinValue>
                            <MaxValue>5</MaxValue>
                            <Datatype>integer</Datatype>
                            <Previous>isSmallerOrEqual</Previous>
                        </Validation>
                    </Field>
                </Type>
                
            </Coefficient>
        </BasicBooleanAttribute>
        
        <DerivedBooleanAttribute>
            <NestingConstraints scope="allruleparts">
                <MaxLevels>3</MaxLevels>
                <NestingConstraint level="remaining">
                    <Connectives>
                        <Conjunction allowed="yes"/>
                        
                        <Disjunction allowed="yes"/>
                        <Any allowed="no"/>
                        <Negation allowed="yes"/>
                    </Connectives>
                </NestingConstraint>
            </NestingConstraints>
        </DerivedBooleanAttribute>
    </BuildingBlocks>
</arf:GUHAFeatureList>

